pclass,survived,name,sex,age,sibsp,parch,ticket,fare,cabin,embarked,boat,body,home.dest
3,no,"van Billiard, Master. Walter John",male,11.5,1,1,A/5. 851,14.5,,S,,1,
3,no,"Patchett, Mr. George",male,19,0,0,358585,14.5,,S,,,
3,no,"van Billiard, Mr. Austin Blyler",male,40.5,0,2,A/5. 851,14.5,,S,,255,
3,no,"Robins, Mrs. Alexander A (Grace Charity Laury)",female,47,1,0,A/5. 3337,14.5,,S,,7,
3,no,"Robins, Mr. Alexander A",male,50,1,0,A/5. 3337,14.5,,S,,119,
3,no,"Garfirth, Mr. John",male,29.88113,0,0,358585,14.5,,S,,,
3,no,"Risien, Mr. Samuel Beard",male,29.88113,0,0,364498,14.5,,S,,,
3,no,"Risien, Mrs. Samuel (Emma)",female,29.88113,0,0,364498,14.5,,S,,,
3,no,"van Billiard, Master. James William",male,29.88113,1,1,A/5. 851,14.5,,S,,,
3,no,"Everett, Mr. Thomas James",male,40.5,0,0,C.A. 6212,15.1,,S,,187,
3,no,"Shellard, Mr. Frederick William",male,29.88113,0,0,C.A. 6212,15.1,,S,,,
3,no,"Boulos, Master. Akar",male,6,1,1,2678,15.2458,,C,,,"Syria Kent, ON"
3,no,"Boulos, Miss. Nourelain",female,9,1,1,2678,15.2458,,C,,,"Syria Kent, ON"
3,no,"Boulos, Mrs. Joseph (Sultana)",female,29.88113,0,2,2678,15.2458,,C,,,"Syria Kent, ON"
3,no,"Bourke, Mrs. John (Catherine)",female,32,1,1,364849,15.5,,Q,,,"Ireland Chicago, IL"
3,no,"Bourke, Mr. John",male,40,1,1,364849,15.5,,Q,,,"Ireland Chicago, IL"
3,no,"Lennon, Miss. Mary",female,29.88113,1,0,370371,15.5,,Q,,,
3,no,"Lennon, Mr. Denis",male,29.88113,1,0,370371,15.5,,Q,,,
3,no,"McEvoy, Mr. Michael",male,29.88113,0,0,36568,15.5,,Q,,,
3,no,"O'Brien, Mr. Thomas",male,29.88113,1,0,370365,15.5,,Q,,,
3,no,"Lindell, Mrs. Edvard Bengtsson (Elin Gerda Persson)",female,30,1,0,349910,15.55,,S,A,,
3,no,"Lindell, Mr. Edvard Bengtsson",male,36,1,0,349910,15.55,,S,A,,
3,no,"Hakkarainen, Mr. Pekka Pietari",male,28,1,0,STON/O2. 3101279,15.85,,S,,,
3,no,"Backstrom, Mr. Karl Alfred",male,32,1,0,3101278,15.85,,S,D,,"Ruotsinphytaa, Finland New York, NY"
3,no,"McNamee, Mrs. Neal (Eileen O'Leary)",female,19,1,0,376566,16.1,,S,,53,
3,no,"Bowen, Mr. David John ""Dai""",male,21,0,0,54636,16.1,,S,,,"Treherbert, Cardiff, Wales"
3,no,"McNamee, Mr. Neal",male,24,1,0,376566,16.1,,S,,,
3,no,"Lobb, Mrs. William Arthur (Cordelia K Stanlick)",female,26,1,0,A/5. 3336,16.1,,S,,,
3,no,"Williams, Mr. Leslie",male,28.5,0,0,54636,16.1,,S,,14,
3,no,"Lobb, Mr. William Arthur",male,30,1,0,A/5. 3336,16.1,,S,,,
3,no,"Cribb, Mr. John Hatfield",male,44,0,1,371362,16.1,,S,,,"Bournemouth, England Newark, NJ"
3,no,"Davison, Mr. Thomas Henry",male,29.88113,1,0,386525,16.1,,S,,,"Liverpool, England Bedford, OH"
3,no,"Thorneycroft, Mr. Percival",male,29.88113,1,0,376564,16.1,,S,,,
3,no,"Arnold-Franchi, Mrs. Josef (Josefine Franchi)",female,18,1,0,349237,17.8,,S,,,"Altdorf, Switzerland"
3,no,"Arnold-Franchi, Mr. Josef",male,25,1,0,349237,17.8,,S,,,"Altdorf, Switzerland"
3,no,"Vander Planke, Mr. Leo Edmondus",male,16,2,0,345764,18,,S,,,
3,no,"Vander Planke, Miss. Augusta Maria",female,18,2,0,345764,18,,S,,,
3,no,"Vander Planke, Mr. Julius",male,31,3,0,345763,18,,S,,,
3,no,"Vander Planke, Mrs. Julius (Emelia Maria Vandemoortele)",female,31,1,0,345763,18,,S,,,
3,no,"Hassan, Mr. Houssein G N",male,11,0,0,2699,18.7875,,C,,,
3,no,"Hagland, Mr. Ingvald Olai Olsen",male,29.88113,1,0,65303,19.9667,,S,,,
3,no,"Hagland, Mr. Konrad Mathias Reiersen",male,29.88113,1,0,65304,19.9667,,S,,,
3,no,"Rosblom, Miss. Salli Helena",female,2,1,1,370129,20.2125,,S,,,
3,no,"Rosblom, Mr. Viktor Richard",male,18,1,1,370129,20.2125,,S,,,
3,no,"Rosblom, Mrs. Viktor (Helena Wilhelmina)",female,41,0,2,370129,20.2125,,S,,,
3,no,"Abbott, Master. Eugene Joseph",male,13,0,2,C.A. 2673,20.25,,S,,,"East Providence, RI"
3,no,"Abbott, Mr. Rossmore Edward",male,16,1,1,C.A. 2673,20.25,,S,,190,"East Providence, RI"
3,no,"Goldsmith, Mr. Frank John",male,33,1,1,363291,20.525,,S,,,"Strood, Kent, England Detroit, MI"
3,no,"Dean, Mr. Bertram Frank",male,26,1,2,C.A. 2315,20.575,,S,,,"Devon, England Wichita, KS"
3,no,"Palsson, Master. Gosta Leonard",male,2,3,1,349909,21.075,,S,,4,
3,no,"Palsson, Miss. Stina Viola",female,3,3,1,349909,21.075,,S,,,
3,no,"Palsson, Master. Paul Folke",male,6,3,1,349909,21.075,,S,,,
3,no,"Palsson, Miss. Torborg Danira",female,8,3,1,349909,21.075,,S,,,
3,no,"Palsson, Mrs. Nils (Alma Cornelia Berglund)",female,29,0,4,349909,21.075,,S,,206,
3,no,"Samaan, Mr. Elias",male,29.88113,2,0,2662,21.6792,,C,,,
3,no,"Samaan, Mr. Hanna",male,29.88113,2,0,2662,21.6792,,C,,,
3,no,"Samaan, Mr. Youssef",male,29.88113,2,0,2662,21.6792,,C,,,
3,no,"Holthen, Mr. Johan Martin",male,28,0,0,C 4001,22.525,,S,,,
3,no,"Olsen, Mr. Henry Margido",male,28,0,0,C 4001,22.525,,S,,173,
3,no,"Andersen, Mr. Albert Karvin",male,32,0,0,C 4001,22.525,,S,,260,"Bergen, Norway"
3,no,"Johnston, Master. William Arthur ""Willie""",male,29.88113,1,2,W./C. 6607,23.45,,S,,,
3,no,"Johnston, Miss. Catherine Helen ""Carrie""",female,29.88113,1,2,W./C. 6607,23.45,,S,,,
3,no,"Johnston, Mr. Andrew G",male,29.88113,1,2,W./C. 6607,23.45,,S,,,
3,no,"Johnston, Mrs. Andrew G (Elizabeth ""Lily"" Watson)",female,29.88113,1,2,W./C. 6607,23.45,,S,,,
3,no,"Van Impe, Miss. Catharina",female,10,0,2,345773,24.15,,S,,,
3,no,"Davies, Mr. John Samuel",male,21,2,0,A/4 48871,24.15,,S,,,"West Bromwich, England Pontiac, MI"
3,no,"Davies, Mr. Alfred J",male,24,2,0,A/4 48871,24.15,,S,,,"West Bromwich, England Pontiac, MI"
3,no,"Van Impe, Mrs. Jean Baptiste (Rosalie Paula Govaert)",female,30,1,1,345773,24.15,,S,,,
3,no,"Van Impe, Mr. Jean Baptiste",male,36,1,1,345773,24.15,,S,,,
3,no,"Lester, Mr. James",male,39,0,0,A/4 48871,24.15,,S,,,
3,no,"Moran, Mr. Daniel J",male,29.88113,1,0,371110,24.15,,Q,,,
3,no,"Ryan, Mr. Patrick",male,29.88113,0,0,371110,24.15,,Q,,,
3,no,"Lefebre, Master. Henry Forbes",male,29.88113,3,1,4133,25.4667,,S,,,
3,no,"Lefebre, Miss. Ida",female,29.88113,3,1,4133,25.4667,,S,,,
3,no,"Lefebre, Miss. Jeannie",female,29.88113,3,1,4133,25.4667,,S,,,
3,no,"Lefebre, Miss. Mathilde",female,29.88113,3,1,4133,25.4667,,S,,,
3,no,"Lefebre, Mrs. Frank (Frances)",female,29.88113,0,4,4133,25.4667,,S,,,
3,no,"Skoog, Miss. Margit Elizabeth",female,2,3,2,347088,27.9,,S,,,
3,no,"Skoog, Master. Harald",male,4,3,2,347088,27.9,,S,,,
3,no,"Skoog, Miss. Mabel",female,9,3,2,347088,27.9,,S,,,
3,no,"Skoog, Master. Karl Thorsten",male,10,3,2,347088,27.9,,S,,,
3,no,"Skoog, Mr. Wilhelm",male,40,1,4,347088,27.9,,S,,,
3,no,"Skoog, Mrs. William (Anna Bernhardina Karlsson)",female,45,1,4,347088,27.9,,S,,,
3,no,"Rice, Master. Eugene",male,2,4,1,382652,29.125,,Q,,,
3,no,"Rice, Master. Arthur",male,4,4,1,382652,29.125,,Q,,,
3,no,"Rice, Master. Eric",male,7,4,1,382652,29.125,,Q,,,
3,no,"Rice, Master. George Hugh",male,8,4,1,382652,29.125,,Q,,,
3,no,"Rice, Master. Albert",male,10,4,1,382652,29.125,,Q,,,
3,no,"Rice, Mrs. William (Margaret Norton)",female,39,0,5,382652,29.125,,Q,,327,
3,no,"Andersson, Miss. Ellis Anna Maria",female,2,4,2,347082,31.275,,S,,,"Sweden Winnipeg, MN"
3,no,"Andersson, Master. Sigvard Harald Elias",male,4,4,2,347082,31.275,,S,,,"Sweden Winnipeg, MN"
3,no,"Andersson, Miss. Ebba Iris Alfrida",female,6,4,2,347082,31.275,,S,,,"Sweden Winnipeg, MN"
3,no,"Andersson, Miss. Ingeborg Constanzia",female,9,4,2,347082,31.275,,S,,,"Sweden Winnipeg, MN"
3,no,"Andersson, Miss. Sigrid Elisabeth",female,11,4,2,347082,31.275,,S,,,"Sweden Winnipeg, MN"
3,no,"Andersson, Mr. Anders Johan",male,39,1,5,347082,31.275,,S,,,"Sweden Winnipeg, MN"
3,no,"Andersson, Mrs. Anders Johan (Alfrida Konstantia Brogren)",female,39,1,5,347082,31.275,,S,,,"Sweden Winnipeg, MN"
3,no,"Asplund, Master. Carl Edgar",male,5,4,2,347077,31.3875,,S,,,"Sweden  Worcester, MA"
3,no,"Asplund, Master. Clarence Gustaf Hugo",male,9,4,2,347077,31.3875,,S,,,"Sweden Worcester, MA"
3,no,"Asplund, Master. Filip Oscar",male,13,4,2,347077,31.3875,,S,,,"Sweden Worcester, MA"
3,no,"Asplund, Mr. Carl Oscar Vilhelm Gustafsson",male,40,1,5,347077,31.3875,,S,,142,"Sweden  Worcester, MA"
3,no,"Ford, Miss. Robina Maggie ""Ruby""",female,9,2,2,W./C. 6608,34.375,,S,,,"Rotherfield, Sussex, England Essex Co, MA"
3,no,"Ford, Mr. William Neal",male,16,1,3,W./C. 6608,34.375,,S,,,"Rotherfield, Sussex, England Essex Co, MA"
3,no,"Ford, Mr. Edward Watson",male,18,2,2,W./C. 6608,34.375,,S,,,"Rotherfield, Sussex, England Essex Co, MA"
3,no,"Ford, Miss. Doolina Margaret ""Daisy""",female,21,2,2,W./C. 6608,34.375,,S,,,"Rotherfield, Sussex, England Essex Co, MA"
3,no,"Ford, Mrs. Edward (Margaret Ann Watson)",female,48,1,3,W./C. 6608,34.375,,S,,,"Rotherfield, Sussex, England Essex Co, MA"
3,no,"Panula, Master. Eino Viljami",male,1,4,1,3101295,39.6875,,S,,,
3,no,"Panula, Master. Urho Abraham",male,2,4,1,3101295,39.6875,,S,,,
3,no,"Panula, Master. Juha Niilo",male,7,4,1,3101295,39.6875,,S,,,
3,no,"Panula, Mr. Jaako Arnold",male,14,4,1,3101295,39.6875,,S,,,
3,no,"Panula, Mr. Ernesti Arvid",male,16,4,1,3101295,39.6875,,S,,,
3,no,"Riihivouri, Miss. Susanna Juhantytar ""Sanni""",female,22,0,0,3101295,39.6875,,S,,,
3,no,"Panula, Mrs. Juha (Maria Emilia Ojala)",female,41,0,5,3101295,39.6875,,S,,,
3,no,"Goodwin, Master. Sidney Leonard",male,1,5,2,CA 2144,46.9,,S,,,"Wiltshire, England Niagara Falls, NY"
3,no,"Goodwin, Master. Harold Victor",male,9,5,2,CA 2144,46.9,,S,,,"Wiltshire, England Niagara Falls, NY"
3,no,"Goodwin, Miss. Jessie Allis",female,10,5,2,CA 2144,46.9,,S,,,"Wiltshire, England Niagara Falls, NY"
3,no,"Goodwin, Master. William Frederick",male,11,5,2,CA 2144,46.9,,S,,,"Wiltshire, England Niagara Falls, NY"
3,no,"Goodwin, Mr. Charles Edward",male,14,5,2,CA 2144,46.9,,S,,,"Wiltshire, England Niagara Falls, NY"
3,no,"Goodwin, Miss. Lillian Amy",female,16,5,2,CA 2144,46.9,,S,,,"Wiltshire, England Niagara Falls, NY"
3,no,"Goodwin, Mr. Charles Frederick",male,40,1,6,CA 2144,46.9,,S,,,"Wiltshire, England Niagara Falls, NY"
3,no,"Goodwin, Mrs. Frederick (Augusta Tyler)",female,43,1,6,CA 2144,46.9,,S,,,"Wiltshire, England Niagara Falls, NY"
3,no,"Ling, Mr. Lee",male,28,0,0,1601,56.4958,,S,,,
3,no,"Lam, Mr. Len",male,29.88113,0,0,1601,56.4958,,S,,,
3,no,"Sage, Master. William Henry",male,14.5,8,2,CA. 2343,69.55,,S,,67,
3,no,"Sage, Master. Thomas Henry",male,29.88113,8,2,CA. 2343,69.55,,S,,,
3,no,"Sage, Miss. Ada",female,29.88113,8,2,CA. 2343,69.55,,S,,,
3,no,"Sage, Miss. Constance Gladys",female,29.88113,8,2,CA. 2343,69.55,,S,,,
3,no,"Sage, Miss. Dorothy Edith ""Dolly""",female,29.88113,8,2,CA. 2343,69.55,,S,,,
3,no,"Sage, Miss. Stella Anna",female,29.88113,8,2,CA. 2343,69.55,,S,,,
3,no,"Sage, Mr. Douglas Bullen",male,29.88113,8,2,CA. 2343,69.55,,S,,,
3,no,"Sage, Mr. Frederick",male,29.88113,8,2,CA. 2343,69.55,,S,,,
3,no,"Sage, Mr. George John Jr",male,29.88113,8,2,CA. 2343,69.55,,S,,,
3,no,"Sage, Mr. John George",male,29.88113,1,9,CA. 2343,69.55,,S,,,
3,no,"Sage, Mrs. John (Annie Bullen)",female,29.88113,1,9,CA. 2343,69.55,,S,,,
3,no,"Storey, Mr. Thomas",male,60.5,0,0,3701,33.29548,,S,,261,
1,yes,"Ismay, Mr. Joseph Bruce",male,49,0,0,112058,0,B52 B54 B56,S,C,,Liverpool
1,yes,"Cornell, Mrs. Robert Clifford (Malvina Helen Lamson)",female,55,2,0,11770,25.7,C101,S,2,,"New York, NY"
1,yes,"Omont, Mr. Alfred Fernand",male,29.88113,0,0,F.C. 12998,25.7417,,C,7,,"Paris, France"
1,yes,"Swift, Mrs. Frederick Joel (Margaret Welles Barron)",female,48,0,0,17466,25.9292,D17,S,8,,"Brooklyn, NY"
1,yes,"Leader, Dr. Alice (Farnham)",female,49,0,0,17465,25.9292,D17,S,8,,"New York, NY"
1,yes,"Salomon, Mr. Abraham L",male,29.88113,0,0,111163,26,,S,1,,"New York, NY"
1,yes,"Newsom, Miss. Helen Monypeny",female,19,0,2,11752,26.2833,D47,S,5,,"New York, NY"
1,yes,"Silverthorne, Mr. Spencer Victor",male,35,0,0,PC 17475,26.2875,E24,S,5,,"St Louis, MO"
1,yes,"McGough, Mr. James Robert",male,36,0,0,PC 17473,26.2875,E25,S,7,,"Philadelphia, PA"
1,yes,"Calderhead, Mr. Edward Pennington",male,42,0,0,PC 17476,26.2875,E24,S,5,,"New York, NY"
1,yes,"Flynn, Mr. John Irwin (""Irving"")",male,36,0,0,PC 17474,26.3875,E25,S,5,,"Brooklyn, NY"
1,yes,"Willard, Miss. Constance",female,21,0,0,113795,26.55,,S,8 10,,"Duluth, MN"
1,yes,"Bjornstrom-Steffansson, Mr. Mauritz Hakan",male,28,0,0,110564,26.55,C52,S,D,,"Stockholm, Sweden / Washington, DC"
1,yes,"Seward, Mr. Frederic Kimber",male,34,0,0,113794,26.55,,S,7,,"New York, NY"
1,yes,"Homer, Mr. Harry (""Mr E Haven"")",male,35,0,0,111426,26.55,,C,15,,"Indianapolis, IN"
1,yes,"Romaine, Mr. Charles Hallace (""Mr C Rolmane"")",male,45,0,0,111428,26.55,,S,9,,"New York, NY"
1,yes,"Anderson, Mr. Harry",male,48,0,0,19952,26.55,E12,S,3,,"New York, NY"
1,yes,"Daly, Mr. Peter Denis ",male,51,0,0,113055,26.55,E17,S,5 9,,"Lima, Peru"
1,yes,"Bonnell, Miss. Elizabeth",female,58,0,0,113783,26.55,C103,S,8,,"Birkdale, England Cleveland, Ohio"
1,yes,"Crosby, Mrs. Edward Gifford (Catherine Elizabeth Halstead)",female,64,1,1,112901,26.55,B26,S,7,,"Milwaukee, WI"
1,yes,"Bradley, Mr. George (""George Arthur Brayton"")",male,29.88113,0,0,111427,26.55,,S,9,,"Los Angeles, CA"
1,yes,"Candee, Mrs. Edward (Helen Churchill Hungerford)",female,53,0,0,PC 17606,27.4458,,C,6,,"Washington, DC"
1,yes,"Rosenbaum, Miss. Edith Louise",female,33,0,0,PC 17613,27.7208,A11,C,11,,"Paris, France"
1,yes,"Frauenthal, Mr. Isaac Gerald",male,43,1,0,17765,27.7208,D40,C,5,,"New York, NY"
1,yes,"Brown, Mrs. James Joseph (Margaret Tobin)",female,44,0,0,PC 17610,27.7208,B4,C,6,,"Denver, CO"
1,yes,"Lindstrom, Mrs. Carl Johan (Sigrid Posse)",female,55,0,0,112377,27.7208,,C,6,,"Stockholm, Sweden"
1,yes,"Cassebeer, Mrs. Henry Arthur Jr (Eleanor Genevieve Fosdick)",female,29.88113,0,0,17770,27.7208,,C,5,,"New York, NY"
1,yes,"Gracie, Col. Archibald IV",male,53,0,0,113780,28.5,C51,C,B,,"Washington, DC"
1,yes,"Tucker, Mr. Gilbert Milligan Jr",male,31,0,0,2543,28.5375,C53,C,7,,"Albany, NY"
1,yes,"Chevre, Mr. Paul Romaine",male,45,0,0,PC 17594,29.7,A9,C,7,,"Paris, France"
1,yes,"Marechal, Mr. Pierre",male,29.88113,0,0,11774,29.7,C47,C,7,,"Paris, France"
1,yes,"Graham, Miss. Margaret Edith",female,19,0,0,112053,30,B42,S,3,,"Greenwich, CT"
1,yes,"Behr, Mr. Karl Howell",male,26,0,0,111369,30,C148,C,5,,"New York, NY"
1,yes,"Barkworth, Mr. Algernon Henry Wilson",male,80,0,0,27042,30,A23,S,B,,"Hessle, Yorks"
1,yes,"Hawksford, Mr. Walter James",male,29.88113,0,0,16988,30,D45,S,3,,"Kingston, Surrey"
1,yes,"Daniel, Mr. Robert Williams",male,27,0,0,113804,30.5,,S,3,,"Philadelphia, PA"
1,yes,"Stahelin-Maeglin, Dr. Max",male,32,0,0,13214,30.5,B50,C,3,,"Basel, Switzerland"
1,yes,"Peuchen, Major. Arthur Godfrey",male,52,0,0,113786,30.5,C104,S,6,,"Toronto, ON"
1,yes,"Saalfeld, Mr. Adolphe",male,29.88113,0,0,19988,30.5,C106,S,3,,"Manchester, England"
1,yes,"Serepeca, Miss. Augusta",female,30,0,0,113798,31,,C,4,,
1,yes,"Blank, Mr. Henry",male,40,0,0,112277,31,A31,C,7,,"Glen Ridge, NJ"
1,yes,"Flegenheim, Mrs. Alfred (Antoinette)",female,29.88113,0,0,PC 17598,31.6833,,S,7,,"New York, NY"
1,yes,"Sloper, Mr. William Thompson",male,28,0,0,113788,35.5,A6,S,7,,"New Britain, CT"
1,yes,"Simonius-Blumer, Col. Oberst Alfons",male,56,0,0,13213,35.5,A26,C,3,,"Basel, Switzerland"
1,yes,"Woolner, Mr. Hugh",male,29.88113,0,0,19947,35.5,C52,S,D,,"London, England"
1,yes,"Lines, Miss. Mary Conover",female,16,0,1,PC 17592,39.4,D28,S,9,,"Paris, France"
1,yes,"Lines, Mrs. Ernest H (Elizabeth Lindsey James)",female,51,0,1,PC 17592,39.4,D28,S,9,,"Paris, France"
1,yes,"Duff Gordon, Lady. (Lucille Christiana Sutherland) (""Mrs Morgan"")",female,48,1,0,11755,39.6,A16,C,1,,London / Paris
1,yes,"Rheims, Mr. George Alexander Lucien",male,29.88113,0,0,PC 17607,39.6,,S,A,,"Paris /  New York, NY"
1,yes,"Frolicher, Miss. Hedwig Margaritha",female,22,0,2,13568,49.5,B39,C,5,,"Zurich, Switzerland"
1,yes,"Mayne, Mlle. Berthe Antonine (""Mrs de Villiers"")",female,24,0,0,PC 17482,49.5042,C90,C,6,,"Belgium  Montreal, PQ"
1,yes,"Appleton, Mrs. Edward Dale (Charlotte Lamson)",female,53,2,0,11769,51.4792,C101,S,D,,"Bayside, Queens, NY"
1,yes,"Brown, Mrs. John Murray (Caroline Lane Lamson)",female,59,2,0,11769,51.4792,C101,S,D,,"Belmont, MA"
1,yes,"Kenyon, Mrs. Frederick R (Marion)",female,29.88113,1,0,17464,51.8625,D21,S,8,,"Southington / Noank, CT"
1,yes,"Davidson, Mrs. Thornton (Orian Hays)",female,27,1,2,F.C. 12750,52,B71,S,3,,"Montreal, PQ"
1,yes,"Holverson, Mrs. Alexander Oskar (Mary Aline Towner)",female,35,1,0,113789,52,,S,8,,"New York, NY"
1,yes,"Taylor, Mr. Elmer Zebley",male,48,1,0,19996,52,C126,S,5 7,,"London /  East Orange, NJ"
1,yes,"Taylor, Mrs. Elmer Zebley (Juliet Cummins Wright)",female,29.88113,1,0,19996,52,C126,S,5 7,,"London /  East Orange, NJ"
1,yes,"Beckwith, Mr. Richard Leonard",male,37,1,1,11751,52.5542,D35,S,5,,"New York, NY"
1,yes,"Kimball, Mr. Edwin Nelson Jr",male,42,1,0,11753,52.5542,D19,S,5,,"Boston, MA"
1,yes,"Kimball, Mrs. Edwin Nelson Jr (Gertrude Parsons)",female,45,1,0,11753,52.5542,D19,S,5,,"Boston, MA"
1,yes,"Beckwith, Mrs. Richard Leonard (Sallie Monypeny)",female,47,1,1,11751,52.5542,D35,S,5,,"New York, NY"
1,yes,"Marvin, Mrs. Daniel Warner (Mary Graham Carmichael Farquarson)",female,18,1,0,113773,53.1,D30,S,10,,"New York, NY"
1,yes,"Chambers, Mr. Norman Campbell",male,27,1,0,113806,53.1,E8,S,5,,"New York, NY / Ithaca, NY"
1,yes,"Chambers, Mrs. Norman Campbell (Bertha Griggs)",female,33,1,0,113806,53.1,E8,S,5,,"New York, NY / Ithaca, NY"
1,yes,"Futrelle, Mrs. Jacques Heath (Lily May Peel)",female,35,1,0,113803,53.1,C123,S,D,,"Scituate, MA"
1,yes,"Bowerman, Miss. Elsie Edith",female,22,0,1,113505,55,E33,S,6,,"St Leonards-on-Sea, England Ohio"
1,yes,"Chibnall, Mrs. (Edith Martha Bowerman)",female,29.88113,0,1,113505,55,E33,S,6,,"St Leonards-on-Sea, England Ohio"
1,yes,"Harder, Mr. George Achilles",male,25,1,0,11765,55.4417,E50,C,5,,"Brooklyn, NY"
1,yes,"Harder, Mrs. George Achilles (Dorothy Annan)",female,25,1,0,11765,55.4417,E50,C,5,,"Brooklyn, NY"
1,yes,"Stengel, Mrs. Charles Emil Henry (Annie May Morris)",female,43,1,0,11778,55.4417,C116,C,5,,"Newark, NJ"
1,yes,"Stengel, Mr. Charles Emil Henry",male,54,1,0,11778,55.4417,C116,C,1,,"Newark, NJ"
1,yes,"Silvey, Mrs. William Baird (Alice Munger)",female,39,1,0,13507,55.9,E44,S,11,,"Duluth, MN"
1,yes,"Francatelli, Miss. Laura Mabel",female,30,0,0,PC 17485,56.9292,E36,C,1,,
1,yes,"Duff Gordon, Sir. Cosmo Edmund (""Mr Morgan"")",male,49,1,0,PC 17485,56.9292,A20,C,1,,London / Paris
1,yes,"Dick, Mrs. Albert Adrian (Vera Gillespie)",female,17,1,0,17474,57,B20,S,3,,"Calgary, AB"
1,yes,"Dick, Mr. Albert Adrian",male,31,1,0,17474,57,B20,S,3,,"Calgary, AB"
1,yes,"Mock, Mr. Philipp Edmund",male,30,1,0,13236,57.75,C78,C,11,,"New York, NY"
1,yes,"Schabert, Mrs. Paul (Emma Mock)",female,35,1,0,13236,57.75,C28,C,11,,"New York, NY"
1,yes,"Hippach, Miss. Jean Gertrude",female,16,0,1,111361,57.9792,B18,C,4,,"Chicago, IL"
1,yes,"Hippach, Mrs. Louis Albert (Ida Sophia Fischer)",female,44,0,1,111361,57.9792,B18,C,4,,"Chicago, IL"
1,yes,"Gibson, Miss. Dorothy Winifred",female,22,0,1,112378,59.4,,C,7,,"New York, NY"
1,yes,"Gibson, Mrs. Leonard (Pauline C Boeson)",female,45,0,1,112378,59.4,,C,7,,"New York, NY"
1,yes,"Rothschild, Mrs. Martin (Elizabeth L. Barrett)",female,54,1,0,PC 17603,59.4,,C,6,,"New York, NY"
1,yes,"Smith, Mrs. Lucien Philip (Mary Eloise Hughes)",female,18,1,0,13695,60,C31,S,6,,"Huntington, WV"
1,yes,"Chaffee, Mrs. Herbert Fuller (Carrie Constance Toogood)",female,47,1,0,W.E.P. 5734,61.175,E31,S,4,,"Amenia, ND"
1,yes,"Williams, Mr. Richard Norris II",male,21,0,1,PC 17597,61.3792,,C,A,,"Geneva, Switzerland / Radnor, PA"
1,yes,"Ostby, Miss. Helene Ragnhild",female,22,0,1,113509,61.9792,B36,C,5,,"Providence, RI"
1,yes,"Greenfield, Mr. William Bertram",male,23,0,1,PC 17759,63.3583,D10 D12,C,7,,"New York, NY"
1,yes,"Greenfield, Mrs. Leo David (Blanche Strouse)",female,45,0,1,PC 17759,63.3583,D10 D12,C,7,,"New York, NY"
1,yes,"Pears, Mrs. Thomas (Edith Wearne)",female,22,1,0,113776,66.6,C2,S,8,,"Isleworth, England"
1,yes,"Aubart, Mme. Leontine Pauline",female,24,0,0,PC 17477,69.3,B35,C,9,,"Paris, France"
1,yes,"Sagesser, Mlle. Emma",female,24,0,0,PC 17477,69.3,B35,C,9,,
1,yes,"Crosby, Miss. Harriet R",female,36,0,2,WE/P 5735,71,B22,S,7,,"Milwaukee, WI"
1,yes,"Cumings, Mrs. John Bradley (Florence Briggs Thayer)",female,38,1,0,PC 17599,71.2833,C85,C,4,,"New York, NY"
1,yes,"Warren, Mrs. Frank Manley (Anna Sophia Atkinson)",female,60,1,0,110813,75.25,D37,C,5,,"Portland, OR"
1,yes,"Bazzani, Miss. Albina",female,32,0,0,11813,76.2917,D15,C,8,,
1,yes,"Bucknell, Mrs. William Robert (Emma Eliza Ward)",female,60,0,0,11813,76.2917,D15,C,8,,"Philadelphia, PA"
1,yes,"Hassab, Mr. Hammad",male,27,0,0,PC 17572,76.7292,D49,C,3,,
1,yes,"Harper, Mr. Henry Sleeper",male,48,1,0,PC 17572,76.7292,D33,C,3,,"New York, NY"
1,yes,"Harper, Mrs. Henry Sleeper (Myna Haxtun)",female,49,1,0,PC 17572,76.7292,D33,C,3,,"New York, NY"
1,yes,"Longley, Miss. Gretchen Fiske",female,21,0,0,13502,77.9583,D9,S,10,,"Hudson, NY"
1,yes,"Hogeboom, Mrs. John C (Anna Andrews)",female,51,1,0,13502,77.9583,D11,S,10,,"Hudson, NY"
1,yes,"Andrews, Miss. Kornelia Theodosia",female,63,1,0,13502,77.9583,D7,S,10,,"Hudson, NY"
1,yes,"Stephenson, Mrs. Walter Bertram (Martha Eustis)",female,52,1,0,36947,78.2667,D20,C,4,,"Haverford, PA"
1,yes,"Eustis, Miss. Elizabeth Mussey",female,54,1,0,36947,78.2667,D20,C,4,,"Brookline, MA"
1,yes,"Barber, Miss. Ellen ""Nellie""",female,26,0,0,19877,78.85,,S,6,,
1,yes,"Cavendish, Mrs. Tyrell William (Julia Florence Siegel)",female,76,1,0,19877,78.85,C46,S,6,,"Little Onn Hall, Staffs"
1,yes,"Frolicher-Stehli, Mrs. Maxmillian (Margaretha Emerentia Stehli)",female,48,1,1,13567,79.2,B41,C,5,,"Zurich, Switzerland"
1,yes,"Frolicher-Stehli, Mr. Maxmillian",male,60,1,1,13567,79.2,B41,C,5,,"Zurich, Switzerland"
1,yes,"Thorne, Mrs. Gertrude Maybelle",female,29.88113,0,0,PC 17585,79.2,,C,D,,"New York, NY"
1,yes,"Taussig, Miss. Ruth",female,18,0,2,110413,79.65,E68,S,8,,"New York, NY"
1,yes,"Taussig, Mrs. Emil (Tillie Mandelbaum)",female,39,1,1,110413,79.65,E67,S,8,,"New York, NY"
1,yes,"Icard, Miss. Amelie",female,38,0,0,113572,80,B28,,6,,
1,yes,"Stone, Mrs. George Nelson (Martha Evelyn)",female,62,0,0,113572,80,B28,,6,,"Cincinatti, OH"
1,yes,"Dodge, Master. Washington",male,4,0,2,33638,81.8583,A34,S,5,,"San Francisco, CA"
1,yes,"Dodge, Dr. Washington",male,53,1,1,33638,81.8583,A34,S,13,,"San Francisco, CA"
1,yes,"Dodge, Mrs. Washington (Ruth Vidaver)",female,54,1,1,33638,81.8583,A34,S,5,,"San Francisco, CA"
1,yes,"Meyer, Mrs. Edgar Joseph (Leila Saks)",female,29.88113,1,0,PC 17604,82.1708,,C,6,,"New York, NY"
1,yes,"Snyder, Mrs. John Pillsbury (Nelle Stevenson)",female,23,1,0,21228,82.2667,B45,S,7,,"Minneapolis, MN"
1,yes,"Snyder, Mr. John Pillsbury",male,24,1,0,21228,82.2667,B45,S,7,,"Minneapolis, MN"
1,yes,"Earnshaw, Mrs. Boulton (Olive Potter)",female,23,0,1,11767,83.1583,C54,C,7,,"Mt Airy, Philadelphia, PA"
1,yes,"Hays, Miss. Margaret Bechstein",female,24,0,0,11767,83.1583,C54,C,7,,"New York, NY"
1,yes,"Compton, Miss. Sara Rebecca",female,39,1,1,PC 17756,83.1583,E49,C,14,,"Lakewood, NJ"
1,yes,"Potter, Mrs. Thomas Jr (Lily Alexenia Wilson)",female,56,0,1,11767,83.1583,C50,C,7,,"Mt Airy, Philadelphia, PA"
1,yes,"Compton, Mrs. Alexander Taylor (Mary Eliza Ingersoll)",female,64,0,2,PC 17756,83.1583,E45,C,14,,"Lakewood, NJ"
1,yes,"Harris, Mrs. Henry Birkhardt (Irene Wallach)",female,35,1,0,36973,83.475,C83,S,D,,"New York, NY"
1,yes,"Maioni, Miss. Roberta",female,16,0,0,110152,86.5,B79,S,8,,
1,yes,"Cherry, Miss. Gladys",female,30,0,0,110152,86.5,B77,S,8,,"London, England"
1,yes,"Rothes, the Countess. of (Lucy Noel Martha Dyer-Edwards)",female,33,0,0,110152,86.5,B77,S,8,,"London  Vancouver, BC"
1,yes,"Goldenberg, Mr. Samuel L",male,49,1,0,17453,89.1042,C92,C,5,,"Paris, France / New York, NY"
1,yes,"Goldenberg, Mrs. Samuel L (Edwiga Grabowska)",female,29.88113,1,0,17453,89.1042,C92,C,5,,"Paris, France / New York, NY"
1,yes,"Minahan, Miss. Daisy E",female,33,1,0,19928,90,C78,Q,14,,"Green Bay, WI"
1,yes,"Hoyt, Mrs. Frederick Maxfield (Jane Anne Forby)",female,35,1,0,19943,90,C93,S,D,,"New York, NY /  Stamford CT"
1,yes,"Minahan, Mrs. William Edward (Lillian E Thorpe)",female,37,1,0,19928,90,C78,Q,14,,"Fond du Lac, WI"
1,yes,"Hoyt, Mr. Frederick Maxfield",male,38,1,0,19943,90,C93,S,D,,"New York, NY /  Stamford CT"
1,yes,"Bishop, Mrs. Dickinson H (Helen Walton)",female,19,1,0,11967,91.0792,B49,C,7,,"Dowagiac, MI"
1,yes,"Bishop, Mr. Dickinson H",male,25,1,0,11967,91.0792,B49,C,7,,"Dowagiac, MI"
1,yes,"Perreault, Miss. Anne",female,30,0,0,12749,93.5,B73,S,3,,
1,yes,"Hays, Mrs. Charles Melville (Clara Jennings Gregg)",female,52,1,1,12749,93.5,B69,S,3,,"Montreal, PQ"
1,yes,"LeRoy, Miss. Bertha",female,30,0,0,PC 17761,106.425,,C,2,,
1,yes,"Douglas, Mrs. Walter Donald (Mahala Dutton)",female,48,1,0,PC 17761,106.425,C86,C,2,,"Deephaven, MN / Cedar Rapids, IA"
1,yes,"Penasco y Castellana, Mrs. Victor de Satode (Maria Josefa Perez de Soto y Vallejo)",female,17,1,0,PC 17758,108.9,C65,C,8,,"Madrid, Spain"
1,yes,"Oliva y Ocana, Dona. Fermina",female,39,0,0,PC 17758,108.9,C105,C,8,,
1,yes,"Thayer, Mr. John Borland Jr",male,17,0,2,17421,110.8833,C70,C,B,,"Haverford, PA"
1,yes,"Thayer, Mrs. John Borland (Marian Longstreth Morris)",female,39,1,1,17421,110.8833,C68,C,4,,"Haverford, PA"
1,yes,"Fleming, Miss. Margaret",female,29.88113,0,0,17421,110.8833,,C,4,,
1,yes,"Newell, Miss. Marjorie",female,23,1,0,35273,113.275,D36,C,6,,"Lexington, MA"
1,yes,"Newell, Miss. Madeleine",female,31,1,0,35273,113.275,D36,C,6,,"Lexington, MA"
1,yes,"Carter, Master. William Thornton II",male,11,1,2,113760,120,B96 B98,S,4,,"Bryn Mawr, PA"
1,yes,"Carter, Miss. Lucile Polk",female,14,1,2,113760,120,B96 B98,S,4,,"Bryn Mawr, PA"
1,yes,"Carter, Mr. William Ernest",male,36,1,2,113760,120,B96 B98,S,C,,"Bryn Mawr, PA"
1,yes,"Carter, Mrs. William Ernest (Lucile Polk)",female,36,1,2,113760,120,B96 B98,S,4,,"Bryn Mawr, PA"
1,yes,"Frauenthal, Dr. Henry William",male,50,2,0,PC 17611,133.65,,S,5,,"New York, NY"
1,yes,"Frauenthal, Mrs. Henry William (Clara Heinsheimer)",female,29.88113,1,0,PC 17611,133.65,,S,5,,"New York, NY"
1,yes,"Spedden, Master. Robert Douglas",male,6,0,2,16966,134.5,E34,C,3,,"Tuxedo Park, NY"
1,yes,"Wilson, Miss. Helen Alice",female,31,0,0,16966,134.5,E39 E41,C,3,,
