pclass,survived,name,sex,age,sibsp,parch,ticket,fare,cabin,embarked,boat,body,home.dest
1,no,"Reuchlin, Jonkheer. John George",male,38,0,0,19972,0,,S,,,"Rotterdam, Netherlands"
1,no,"Andrews, Mr. Thomas Jr",male,39,0,0,112050,0,A36,S,,,"Belfast, NI"
1,no,"Harrison, Mr. William",male,40,0,0,112059,0,B94,S,,110,
1,no,"Chisholm, Mr. Roderick Robert Crispin",male,29.88113,0,0,112051,0,,S,,,"Liverpool, England / Belfast"
1,no,"Fry, Mr. Richard",male,29.88113,0,0,112058,0,B102,S,,,
1,no,"Parr, Mr. William Henry Marsh",male,29.88113,0,0,112052,0,,S,,,Belfast
1,no,"Carlsson, Mr. Frans Olof",male,33,0,0,695,5,B51 B53 B55,S,,,"New York, NY"
1,no,"Colley, Mr. Edward Pomeroy",male,47,0,0,5727,25.5875,E58,S,,,"Victoria, BC"
1,no,"Baumann, Mr. John D",male,29.88113,0,0,PC 17318,25.925,,S,,,"New York, NY"
1,no,"Birnbaum, Mr. Jakob",male,25,0,0,13905,26,,C,,148,"San Francisco, CA"
1,no,"Maguire, Mr. John Edward",male,30,0,0,110469,26,C106,S,,,"Brockton, MA"
1,no,"Jones, Mr. Charles Cresson",male,46,0,0,694,26,,S,,80,"Bennington, VT"
1,no,"Case, Mr. Howard Brown",male,49,0,0,19924,26,,S,,,"Ascot, Berkshire / Rochester, NY"
1,no,"Julian, Mr. Henry Forbes",male,50,0,0,113044,26,E60,S,,,London
1,no,"Nicholson, Mr. Arthur Ernest",male,64,0,0,693,26,,S,,263,"Isle of Wight, England"
1,no,"Smith, Mr. Richard William",male,29.88113,0,0,113056,26,A19,S,,,"Streatham, Surrey"
1,no,"Rowe, Mr. Alfred G",male,33,0,0,113790,26.55,,S,,109,London
1,no,"Borebank, Mr. John James",male,42,0,0,110489,26.55,D22,S,,,"London / Winnipeg, MB"
1,no,"Lindeberg-Lind, Mr. Erik Gustaf (""Mr Edward Lingrey"")",male,42,0,0,17475,26.55,,S,,,"Stockholm, Sweden"
1,no,"Butt, Major. Archibald Willingham",male,45,0,0,113050,26.55,B38,S,,,"Washington, DC"
1,no,"Smart, Mr. John Montgomery",male,56,0,0,113792,26.55,,S,,,"New York, NY"
1,no,"Weir, Col. John",male,60,0,0,113800,26.55,,S,,,"England Salt Lake City, Utah"
1,no,"Stead, Mr. William Thomas",male,62,0,0,113514,26.55,C87,S,,,"Wimbledon Park, London / Hayling Island, Hants"
1,no,"Wright, Mr. George",male,62,0,0,113807,26.55,,S,,,"Halifax, NS"
1,no,"Millet, Mr. Francis Davis",male,65,0,0,13509,26.55,E38,S,,249,"East Bridgewater, MA"
1,no,"Crafton, Mr. John Bertram",male,29.88113,0,0,113791,26.55,,S,,,"Roachdale, IN"
1,no,"Franklin, Mr. Thomas Parham",male,29.88113,0,0,113778,26.55,D34,S,,,"Westcliff-on-Sea, Essex"
1,no,"Klaber, Mr. Herman",male,29.88113,0,0,113028,26.55,C124,S,,,"Portland, OR"
1,no,"Ovies y Rodriguez, Mr. Servando",male,28.5,0,0,PC 17562,27.7208,D43,C,,189,"?Havana, Cuba"
1,no,"Uruchurtu, Don. Manuel E",male,40,0,0,PC 17601,27.7208,,C,,,"Mexico City, Mexico"
1,no,"Lewy, Mr. Ervin G",male,29.88113,0,0,PC 17612,27.7208,,C,,,"Chicago, IL"
1,no,"Stewart, Mr. Albert A",male,29.88113,0,0,PC 17605,27.7208,,C,,,"Gallipolis, Ohio / ? Paris / New York"
1,no,"Foreman, Mr. Benjamin Laventall",male,30,0,0,113051,27.75,C111,C,,,"New York, NY"
1,no,"Partner, Mr. Austen",male,45.5,0,0,113043,28.5,C124,S,,166,"Surbiton Hill, Surrey"
1,no,"Isham, Miss. Ann Elizabeth",female,50,0,0,PC 17595,28.7125,C49,C,,,"Paris, France New York, NY"
1,no,"Natsch, Mr. Charles H",male,37,0,1,PC 17596,29.7,C118,C,,,"Brooklyn, NY"
1,no,"Dulles, Mr. William Crothers",male,39,0,0,PC 17580,29.7,A18,C,,133,"Philadelphia, PA"
1,no,"Kent, Mr. Edward Austin",male,58,0,0,11771,29.7,B37,C,,258,"Buffalo, NY"
1,no,"Long, Mr. Milton Clyde",male,29,0,0,113501,30,D6,S,,126,"Springfield, MA"
1,no,"Brady, Mr. John Bertram",male,41,0,0,113054,30.5,A21,S,,,"Pomeroy, WA"
1,no,"Molson, Mr. Harry Markland",male,55,0,0,113787,30.5,C30,S,,,"Montreal, PQ"
1,no,"Smith, Mr. James Clinch",male,56,0,0,17764,30.6958,A7,C,,,"St James, Long Island, NY"
1,no,"Hoyt, Mr. William Fisher",male,29.88113,0,0,PC 17600,30.6958,,C,14,,"New York, NY"
1,no,"Cairns, Mr. Alexander",male,29.88113,0,0,113798,31,,S,,,
1,no,"Evans, Miss. Edith Corse",female,36,0,0,PC 17531,31.6792,A29,C,,,"New York, NY"
1,no,"Sutton, Mr. Frederick",male,61,0,0,36963,32.3208,D50,S,,46,"Haddenfield, NJ"
1,no,"Van der hoef, Mr. Wyckoff",male,61,0,0,111240,33.5,B19,S,,245,"Brooklyn, NY"
1,no,"Walker, Mr. William Anderson",male,47,0,0,36967,34.0208,D46,S,,,"East Orange, NJ"
1,no,"Goldschmidt, Mr. George B",male,71,0,0,PC 17754,34.6542,A5,C,,,"New York, NY"
1,no,"Williams-Lambert, Mr. Fletcher Fellows",male,29.88113,0,0,113510,35,C128,S,,,"London, England"
1,no,"Blackwell, Mr. Stephen Weart",male,45,0,0,113784,35.5,T,S,,,"Trenton, NJ"
1,no,"Gee, Mr. Arthur H",male,47,0,0,111320,38.5,E63,S,,275,"St Anne's-on-Sea, Lancashire"
1,no,"Brewe, Dr. Arthur Jackson",male,29.88113,0,0,112379,39.6,,C,,,"Philadelphia, PA"
1,no,"Ross, Mr. John Hugo",male,36,0,0,13049,40.125,A10,C,,,"Winnipeg, MB"
1,no,"Moore, Mr. Clarence Bloomfield",male,47,0,0,113796,42.4,,S,,,"Washington, DC"
1,no,"Harrington, Mr. Charles H",male,29.88113,0,0,113796,42.4,,S,,,
1,no,"Head, Mr. Christopher",male,42,0,0,113038,42.5,B11,S,,,London / Middlesex
1,no,"Loring, Mr. Joseph Holland",male,30,0,0,113801,45.5,,S,,,"London / New York, NY"
1,no,"Carrau, Mr. Jose Pedro",male,17,0,0,113059,47.1,,S,,,"Montevideo, Uruguay"
1,no,"Carrau, Mr. Francisco M",male,28,0,0,113059,47.1,,S,,,"Montevideo, Uruguay"
1,no,"Artagaveytia, Mr. Ramon",male,71,0,0,PC 17609,49.5042,,C,,22,"Montevideo, Uruguay"
1,no,"Hipkins, Mr. William Edward",male,55,0,0,680,50,C39,S,,,London / Birmingham
1,no,"Rood, Mr. Hugh Roscoe",male,29.88113,0,0,113767,50,A32,S,,,"Seattle, WA"
1,no,"Roebling, Mr. Washington Augustus II",male,31,0,0,PC 17590,50.4958,A24,S,,,"Trenton, NJ"
1,no,"Brandeis, Mr. Emil",male,48,0,0,PC 17591,50.4958,B10,C,,208,"Omaha, NE"
1,no,"Kenyon, Mr. Frederick R",male,41,1,0,17464,51.8625,D21,S,,,"Southington / Noank, CT"
1,no,"McCarthy, Mr. Timothy J",male,54,0,0,17463,51.8625,E46,S,,175,"Dorchester, MA"
1,no,"Hilliard, Mr. Herbert Henry",male,29.88113,0,0,17463,51.8625,E46,S,,,"Brighton, MA"
1,no,"Davidson, Mr. Thornton",male,31,1,0,F.C. 12750,52,B71,S,,,"Montreal, PQ"
1,no,"Holverson, Mr. Alexander Oskar",male,42,1,0,113789,52,,S,,38,"New York, NY"
1,no,"Porter, Mr. Walter Chamberlain",male,47,0,0,110465,52,C110,S,,207,"Worcester, MA"
1,no,"Clifford, Mr. George Quincy",male,29.88113,0,0,110465,52,A14,S,,,"Stoughton, MA"
1,no,"Marvin, Mr. Daniel Warner",male,19,1,0,113773,53.1,D30,S,,,"New York, NY"
1,no,"Futrelle, Mr. Jacques Heath",male,37,1,0,113803,53.1,C123,S,,,"Scituate, MA"
1,no,"Silvey, Mr. William Baird",male,50,1,0,13507,55.9,E44,S,,,"Duluth, MN"
1,no,"Rothschild, Mr. Martin",male,55,1,0,PC 17603,59.4,,C,,,"New York, NY"
1,no,"Smith, Mr. Lucien Philip",male,24,1,0,13695,60,C31,S,,,"Huntington, WV"
1,no,"Chaffee, Mr. Herbert Fuller",male,46,1,0,W.E.P. 5734,61.175,E31,S,,,"Amenia, ND"
1,no,"Williams, Mr. Charles Duane",male,51,0,1,PC 17597,61.3792,,C,,,"Geneva, Switzerland / Radnor, PA"
1,no,"Ostby, Mr. Engelhart Cornelius",male,65,0,1,113509,61.9792,B30,C,,234,"Providence, RI"
1,no,"Pears, Mr. Thomas Clinton",male,29,1,0,113776,66.6,C2,S,,,"Isleworth, England"
1,no,"Crosby, Capt. Edward Gifford",male,70,1,1,WE/P 5735,71,B22,S,,269,"Milwaukee, WI"
1,no,"Cumings, Mr. John Bradley",male,39,1,0,PC 17599,71.2833,C85,C,,,"New York, NY"
1,no,"Beattie, Mr. Thomson",male,36,0,0,13050,75.2417,C6,C,A,,"Winnipeg, MN"
1,no,"McCaffry, Mr. Thomas Francis",male,46,0,0,13050,75.2417,C6,C,,292,"Vancouver, BC"
1,no,"Warren, Mr. Frank Manley",male,64,1,0,110813,75.25,D37,C,,,"Portland, OR"
1,no,"White, Mr. Richard Frasar",male,21,0,1,35281,77.2875,D26,S,,169,"Brunswick, ME"
1,no,"White, Mr. Percival Wayland",male,54,0,1,35281,77.2875,D26,S,,,"Brunswick, ME"
1,no,"Cavendish, Mr. Tyrell William",male,36,1,0,19877,78.85,C46,S,,172,"Little Onn Hall, Staffs"
1,no,"Giglio, Mr. Victor",male,24,0,0,PC 17593,79.2,B86,C,,,
1,no,"Guggenheim, Mr. Benjamin",male,46,0,0,PC 17593,79.2,B82 B84,C,,,"New York, NY"
1,no,"Rosenshine, Mr. George (""Mr George Thorne"")",male,46,0,0,PC 17585,79.2,,C,,16,"New York, NY"
1,no,"Taussig, Mr. Emil",male,52,1,1,110413,79.65,E67,S,,,"New York, NY"
1,no,"Meyer, Mr. Edgar Joseph",male,28,1,0,PC 17604,82.1708,,C,,,"New York, NY"
1,no,"Compton, Mr. Alexander Taylor Jr",male,37,1,1,PC 17756,83.1583,E52,C,,,"Lakewood, NJ"
1,no,"Harris, Mr. Henry Birkhardt",male,45,1,0,36973,83.475,C83,S,,,"New York, NY"
1,no,"Minahan, Dr. William Edward",male,44,2,0,19928,90,C78,Q,,230,"Fond du Lac, WI"
1,no,"Payne, Mr. Vivian Ponsonby",male,23,0,0,12749,93.5,B24,S,,,"Montreal, PQ"
1,no,"Hays, Mr. Charles Melville",male,55,1,1,12749,93.5,B69,S,,307,"Montreal, PQ"
1,no,"Douglas, Mr. Walter Donald",male,50,1,0,PC 17761,106.425,C86,C,,62,"Deephaven, MN / Cedar Rapids, IA"
1,no,"Penasco y Castellana, Mr. Victor de Satode",male,18,1,0,PC 17758,108.9,C65,C,,,"Madrid, Spain"
1,no,"Thayer, Mr. John Borland",male,49,1,1,17421,110.8833,C68,C,,,"Haverford, PA"
1,no,"Newell, Mr. Arthur Webster",male,58,0,2,35273,113.275,D48,C,,122,"Lexington, MA"
1,no,"Ringhini, Mr. Sante",male,22,0,0,PC 17760,135.6333,,C,,232,
1,no,"Clark, Mr. Walter Miller",male,27,1,0,13508,136.7792,C89,C,,,"Los Angeles, CA"
1,no,"Spencer, Mr. William Augustus",male,57,1,0,PC 17569,146.5208,B78,C,,,"Paris, France"
1,no,"Allison, Miss. Helen Loraine",female,2,1,2,113781,151.55,C22 C26,S,,,"Montreal, PQ / Chesterville, ON"
1,no,"Allison, Mrs. Hudson J C (Bessie Waldo Daniels)",female,25,1,2,113781,151.55,C22 C26,S,,,"Montreal, PQ / Chesterville, ON"
1,no,"Allison, Mr. Hudson Joshua Creighton",male,30,1,2,113781,151.55,C22 C26,S,,135,"Montreal, PQ / Chesterville, ON"
1,no,"Graham, Mr. George Edward",male,38,0,1,PC 17582,153.4625,C91,S,,147,"Winnipeg, MB"
1,no,"Wick, Mr. George Dennick",male,57,1,1,36928,164.8667,,S,,,"Youngstown, OH"
1,no,"Widener, Mr. Harry Elkins",male,27,0,2,113503,211.5,C82,C,,,"Elkins Park, PA"
1,no,"Keeping, Mr. Edwin",male,32.5,0,0,113503,211.5,C132,C,,45,
1,no,"Widener, Mr. George Dunton",male,50,1,1,113503,211.5,C80,C,,,"Elkins Park, PA"
1,no,"Straus, Mrs. Isidor (Rosalie Ida Blun)",female,63,1,0,PC 17483,221.7792,C55 C57,S,,,"New York, NY"
1,no,"Straus, Mr. Isidor",male,67,1,0,PC 17483,221.7792,C55 C57,S,,96,"New York, NY"
1,no,"Farthing, Mr. John",male,29.88113,0,0,PC 17483,221.7792,C95,S,,,
1,no,"Astor, Col. John Jacob",male,47,1,0,PC 17757,227.525,C62 C64,C,,124,"New York, NY"
1,no,"Robbins, Mr. Victor",male,29.88113,0,0,PC 17757,227.525,,C,,,
1,no,"Baxter, Mr. Quigg Edmond",male,24,0,1,PC 17558,247.5208,B58 B60,C,,,"Montreal, PQ"
1,no,"Ryerson, Mr. Arthur Larned",male,61,1,3,PC 17608,262.375,B57 B59 B63 B66,C,,,"Haverford, PA / Cooperstown, NY"
1,no,"Fortune, Mr. Charles Alexander",male,19,3,2,19950,263,C23 C25 C27,S,,,"Winnipeg, MB"
1,no,"Fortune, Mr. Mark",male,64,1,4,19950,263,C23 C25 C27,S,,,"Winnipeg, MB"
2,no,"Campbell, Mr. William",male,29.88113,0,0,239853,0,,S,,,Belfast
2,no,"Cunningham, Mr. Alfred Fleming",male,29.88113,0,0,239853,0,,S,,,Belfast
2,no,"Frost, Mr. Anthony Wood ""Archie""",male,29.88113,0,0,239854,0,,S,,,Belfast
2,no,"Knight, Mr. Robert J",male,29.88113,0,0,239855,0,,S,,,Belfast
2,no,"Parkes, Mr. Francis ""Frank""",male,29.88113,0,0,239853,0,,S,,,Belfast
2,no,"Watson, Mr. Ennis Hastings",male,29.88113,0,0,239856,0,,S,,,Belfast
2,no,"Myles, Mr. Thomas Francis",male,62,0,0,240276,9.6875,,Q,,,"Cambridge, MA"
2,no,"Mudd, Mr. Thomas Charles",male,16,0,0,S.O./P.P. 3,10.5,,S,,,"Halesworth, England"
2,no,"Fillbrook, Mr. Joseph Charles",male,18,0,0,C.A. 15185,10.5,,S,,,"Cornwall / Houghton, MI"
2,no,"Pengelly, Mr. Frederick William",male,19,0,0,28665,10.5,,S,,,"Gunnislake, England / Butte, MT"
2,no,"Rogers, Mr. Reginald Harry",male,19,0,0,28004,10.5,,S,,,
2,no,"Baimbrigge, Mr. Charles Robert",male,23,0,0,C.A. 31030,10.5,,S,,,Guernsey
2,no,"Pain, Dr. Alfred",male,23,0,0,244278,10.5,,S,,,"Hamilton, ON"
2,no,"Ware, Mr. William Jeffery",male,23,1,0,28666,10.5,,S,,,
2,no,"Leyson, Mr. Robert William Norman",male,24,0,0,C.A. 29566,10.5,,S,,108,
2,no,"Andrew, Mr. Frank Thomas",male,25,0,0,C.A. 34050,10.5,,S,,,"Cornwall, England Houghton, MI"
2,no,"Stokes, Mr. Philip Joseph",male,25,0,0,F.C.C. 13540,10.5,,S,,81,"Catford, Kent / Detroit, MI"
2,no,"Gavey, Mr. Lawrence",male,26,0,0,31028,10.5,,S,,,"Guernsey / Elizabeth, NJ"
2,no,"Banfield, Mr. Frederick James",male,28,0,0,C.A./SOTON 34068,10.5,,S,,,"Plymouth, Dorset / Houghton, MI"
2,no,"Parker, Mr. Clifford Richard",male,28,0,0,SC 14888,10.5,,S,,,"St Andrews, Guernsey"
2,no,"Coleridge, Mr. Reginald Charles",male,29,0,0,W./C. 14263,10.5,,S,,,"Hartford, Huntingdonshire"
2,no,"Harris, Mr. Walter",male,30,0,0,W/C 14208,10.5,,S,,,"Walthamstow, England"
2,no,"Kvillner, Mr. Johan Henrik Johannesson",male,31,0,0,C.A. 18723,10.5,,S,,165,"Sweden / Arlington, NJ"
2,no,"Jenkin, Mr. Stephen Curnow",male,32,0,0,C.A. 33111,10.5,,S,,,"St Ives, Cornwall / Houghton, MI"
2,no,"Slemen, Mr. Richard James",male,35,0,0,28206,10.5,,S,,,Cornwall
2,no,"Reeves, Mr. David",male,36,0,0,C.A. 17248,10.5,,S,,,"Brighton, Sussex"
2,no,"Gilbert, Mr. William",male,47,0,0,C.A. 30769,10.5,,S,,,Cornwall
2,no,"Mack, Mrs. (Mary)",female,57,0,0,S.O./P.P. 3,10.5,E77,S,,52,"Southampton / New York, NY"
2,no,"Wheadon, Mr. Edward H",male,66,0,0,C.A. 24579,10.5,,S,,,"Guernsey, England / Edgewood, RI"
2,no,"Mitchell, Mr. Henry Michael",male,70,0,0,C.A. 24580,10.5,,S,,,"Guernsey / Montclair, NJ and/or Toledo, Ohio"
2,no,"Lamb, Mr. John Joseph",male,29.88113,0,0,240261,10.7083,,Q,,,
2,no,"Andrew, Mr. Edgardo Samuel",male,18,0,0,231945,11.5,,S,,,"Buenos Aires, Argentina / New Jersey, NJ"
2,no,"Bailey, Mr. Percy Andrew",male,18,0,0,29108,11.5,,S,,,"Penzance, Cornwall / Akron, OH"
2,no,"Cotterill, Mr. Henry ""Harry""",male,21,0,0,29107,11.5,,S,,,"Penzance, Cornwall / Akron, OH"
2,no,"Giles, Mr. Edgar",male,21,1,0,28133,11.5,,S,,,"Cornwall / Camden, NJ"
2,no,"Giles, Mr. Frederick Edward",male,21,1,0,28134,11.5,,S,,,"Cornwall / Camden, NJ"
2,no,"Hocking, Mr. Richard George",male,23,2,1,29104,11.5,,S,,,"Cornwall / Akron, OH"
2,no,"Hunt, Mr. George Henry",male,33,0,0,SCO/W 1585,12.275,,S,,,"Philadelphia, PA"
2,no,"Keane, Mr. Daniel",male,35,0,0,233734,12.35,,Q,,,
2,no,"Kirkland, Rev. Charles Leonard",male,57,0,0,219533,12.35,,Q,,,"Glasgow / Bangor, ME"
2,no,"Lingane, Mr. John",male,61,0,0,235509,12.35,,Q,,,
2,no,"Bateman, Rev. Robert James",male,51,0,0,S.O.P. 1166,12.525,,S,,174,"Jacksonville, FL"
2,no,"Levy, Mr. Rene Jacques",male,36,0,0,SC/Paris 2163,12.875,D,C,,,"Montreal, PQ"
2,no,"Wheeler, Mr. Edwin ""Frederick""",male,29.88113,0,0,SC/PARIS 2159,12.875,,S,,,
2,no,"Fahlstrom, Mr. Arne Jonas",male,18,0,0,236171,13,,S,,,"Oslo, Norway Bayonne, NJ"
2,no,"Hiltunen, Miss. Marta",female,18,1,1,250650,13,,S,,,"Kontiolahti, Finland / Detroit, MI"
2,no,"Swane, Mr. George",male,18.5,0,0,248734,13,F,S,,294,
2,no,"Carbines, Mr. William",male,19,0,0,28424,13,,S,,18,"St Ives, Cornwall / Calumet, MI"
2,no,"Enander, Mr. Ingvar",male,21,0,0,236854,13,,S,,,"Goteborg, Sweden / Rockford, IL"
2,no,"Berriman, Mr. William John",male,23,0,0,28425,13,,S,,,"St Ives, Cornwall / Calumet, MI"
2,no,"Eitemiller, Mr. George Floyd",male,23,0,0,29751,13,,S,,,"England / Detroit, MI"
2,no,"Troupiansky, Mr. Moses Aaron",male,23,0,0,233639,13,,S,,,
2,no,"Gill, Mr. John William",male,24,0,0,233866,13,,S,,155,"Clevedon, England"
2,no,"Yrois, Miss. Henriette (""Mrs Harbeck"")",female,24,0,0,248747,13,,S,,,Paris
2,no,"Butler, Mr. Reginald Fenton",male,25,0,0,234686,13,,S,,97,"Southsea, Hants"
2,no,"Sedgwick, Mr. Charles Frederick Waddington",male,25,0,0,244361,13,,S,,,Liverpool
2,no,"Sobey, Mr. Samuel James Hayden",male,25,0,0,C.A. 29178,13,,S,,,"Cornwall / Houghton, MI"
2,no,"Botsford, Mr. William Hull",male,26,0,0,237670,13,,S,,,"Elmira, NY / Orange, NJ"
2,no,"Nesson, Mr. Israel",male,26,0,0,244368,13,F2,S,,,"Boston, MA"
2,no,"Schmidt, Mr. August",male,26,0,0,248659,13,,S,,,"Newark, NJ"
2,no,"Bracken, Mr. James H",male,27,0,0,220367,13,,S,,,"Lake Arthur, Chavez County, NM"
2,no,"Montvila, Rev. Juozas",male,27,0,0,211536,13,,S,,,"Worcester, MA"
2,no,"Collander, Mr. Erik Gustaf",male,28,0,0,248740,13,,S,,,"Helsinki, Finland Ashtabula, Ohio"
2,no,"Aldworth, Mr. Charles Augustus",male,30,0,0,248744,13,,S,,,"Bryn Mawr, PA, USA"
2,no,"Corbett, Mrs. Walter H (Irene Colvin)",female,30,0,0,237249,13,,S,,,"Provo, UT"
2,no,"Givard, Mr. Hans Kristensen",male,30,0,0,250646,13,,S,,305,
2,no,"Hale, Mr. Reginald",male,30,0,0,250653,13,,S,,75,"Auburn, NY"
2,no,"Matthews, Mr. William John",male,30,0,0,28228,13,,S,,,"St Austall, Cornwall"
2,no,"McCrie, Mr. James Matthew",male,30,0,0,233478,13,,S,,,"Sarnia, ON"
2,no,"de Brito, Mr. Jose Joaquim",male,32,0,0,244360,13,,S,,,"Portugal / Sau Paulo, Brazil"
2,no,"Gillespie, Mr. William Henry",male,34,0,0,12233,13,,S,,,"Vancouver, BC"
2,no,"Ponesell, Mr. Martin",male,34,0,0,250647,13,,S,,,"Denmark / New York, NY"
2,no,"Fox, Mr. Stanley Hubert",male,36,0,0,229236,13,,S,,236,"Rochester, NY"
2,no,"Hocking, Mr. Samuel James Metcalfe",male,36,0,0,242963,13,,S,,,"Devonport, England"
2,no,"Funk, Miss. Annie Clemmer",female,38,0,0,237671,13,,S,,,"Janjgir, India / Pennsylvania"
2,no,"Meyer, Mr. August",male,39,0,0,248723,13,,S,,,"Harrow-on-the-Hill, Middlesex"
2,no,"Otter, Mr. Richard",male,39,0,0,28213,13,,S,,,"Middleburg Heights, OH"
2,no,"Veal, Mr. James",male,40,0,0,28221,13,,S,,,"Barre, Co Washington, VT"
2,no,"Peruschitz, Rev. Joseph Maria",male,41,0,0,237393,13,,S,,,
2,no,"Bowenur, Mr. Solomon",male,42,0,0,211535,13,,S,,,London
2,no,"Byles, Rev. Thomas Roussel Davids",male,42,0,0,244310,13,,S,,,London
2,no,"Harbeck, Mr. William H",male,44,0,0,248746,13,,S,,35,"Seattle, WA / Toledo, OH"
2,no,"Milling, Mr. Jacob Christian",male,48,0,0,234360,13,,S,,271,"Copenhagen, Denmark"
2,no,"Hodges, Mr. Henry Price",male,50,0,0,250643,13,,S,,149,Southampton
2,no,"Greenberg, Mr. Samuel",male,52,0,0,250647,13,,S,,19,"Bronx, NY"
2,no,"Ashby, Mr. John",male,57,0,0,244346,13,,S,,,"West Hoboken, NJ"
2,no,"Giles, Mr. Ralph",male,24,0,0,248726,13.5,,S,,297,"West Kensington, London"
2,no,"Norman, Mr. Robert Douglas",male,28,0,0,218629,13.5,,S,,287,Glasgow
2,no,"McCrae, Mr. Arthur Gordon",male,32,0,0,237216,13.5,,S,,209,"Sydney, Australia"
2,no,"Chapman, Mr. Charles Henry",male,52,0,0,248731,13.5,,S,,130,"Bronx, NY"
2,no,"Sjostedt, Mr. Ernst Adolf",male,59,0,0,237442,13.5,,S,,,"Sault St Marie, ON"
2,no,"Moraweck, Dr. Ernest",male,54,0,0,29011,14,,S,,,"Frankfort, KY"
2,no,"Jarvis, Mr. John Denzil",male,47,0,0,237565,15,,S,,,"North Evington, England"
2,no,"Pulbaum, Mr. Franz",male,27,0,0,SC/PARIS 2168,15.0333,,C,,,Paris
2,no,"Richard, Mr. Emile",male,23,0,0,SC/PARIS 2133,15.0458,,C,,,"Paris / Montreal, PQ"
2,no,"Stanton, Mr. Samuel Ward",male,41,0,0,237734,15.0458,,C,,,"New York, NY"
2,no,"Malachard, Mr. Noel",male,29.88113,0,0,237735,15.0458,D,C,,,Paris
2,no,"Pernot, Mr. Rene",male,29.88113,0,0,SC/PARIS 2131,15.05,,C,,,
2,no,"Mangiavacchi, Mr. Serafino Emilio",male,29.88113,0,0,SC/A.3 2861,15.5792,,C,,,"New York, NY"
2,no,"Maybery, Mr. Frank Hubert",male,40,0,0,239059,16,,S,,,"Weston-Super-Mare / Moose Jaw, SK"
2,no,"Karnes, Mrs. J Frank (Claire Bennett)",female,22,0,0,F.C.C. 13534,21,,S,,,"India / Pittsburgh, PA"
2,no,"Turpin, Mrs. William John Robert (Dorothy Ann Wonnacott)",female,27,1,0,11668,21,,S,,,"Plymouth, England"
2,no,"Turpin, Mr. William John Robert",male,29,1,0,11668,21,,S,,,"Plymouth, England"
2,no,"Ware, Mr. John James",male,30,1,0,CA 31352,21,,S,,,"Bristol, England / New Britain, CT"
2,no,"Gale, Mr. Shadrach",male,34,1,0,28664,21,,S,,,"Cornwall / Clear Creek, CO"
2,no,"Renouf, Mr. Peter Henry",male,34,1,0,31027,21,,S,12,,"Elizabeth, NJ"
2,no,"Gale, Mr. Harry",male,38,1,0,28664,21,,S,,,"Cornwall / Clear Creek, CO"
2,no,"Phillips, Mr. Escott Robert",male,43,0,1,S.O./P.P. 2,21,,S,,,"Ilfracombe, Devon"
2,no,"Corey, Mrs. Percy C (Mary Phyllis Elizabeth Miller)",female,29.88113,0,0,F.C.C. 13534,21,,S,,,"Upper Burma, India Pittsburgh, PA"
2,no,"Abelson, Mr. Samuel",male,30,1,0,P/PP 3381,24,,C,,,"Russia New York, NY"
2,no,"Gaskell, Mr. Alfred",male,16,0,0,239865,26,,S,,,"Liverpool / Montreal, PQ"
2,no,"Bryhl, Mr. Kurt Arnold Gottfrid",male,25,1,0,236853,26,,S,,,"Skara, Sweden / Rockford, IL"
2,no,"Lahtinen, Mrs. William (Anna Sylfven)",female,26,1,1,250651,26,,S,,,"Minneapolis, MN"
2,no,"Sharp, Mr. Percival James R",male,27,0,0,244358,26,,S,,,"Hornsey, England"
2,no,"Weisz, Mr. Leopold",male,27,1,0,228414,26,,S,,293,"Bromsgrove, England / Montreal, PQ"
2,no,"Beauchamp, Mr. Henry James",male,28,0,0,244358,26,,S,,,England
2,no,"Chapman, Mrs. John Henry (Sara Elizabeth Lawry)",female,29,1,0,SC/AH 29037,26,,S,,,"Cornwall / Spokane, WA"
2,no,"Clarke, Mr. Charles Valentine",male,29,1,0,2003,26,,S,,,"England / San Francisco, CA"
2,no,"Lahtinen, Rev. William",male,30,1,1,250651,26,,S,,,"Minneapolis, MN"
2,no,"Angle, Mr. William A",male,34,1,0,226875,26,,S,,,"Warwick, England"
2,no,"Kantor, Mr. Sinai",male,34,1,0,244367,26,,S,,283,"Moscow / Bronx, NY"
2,no,"Fynney, Mr. Joseph J",male,35,0,0,239865,26,,S,,322,"Liverpool / Montreal, PQ"
2,no,"Navratil, Mr. Michel (""Louis M Hoffman"")",male,36.5,0,2,230080,26,F2,S,,15,"Nice, France"
2,no,"Chapman, Mr. John Henry",male,37,1,0,SC/AH 29037,26,,S,,17,"Cornwall / Spokane, WA"
2,no,"Morley, Mr. Henry Samuel (""Mr Henry Marshall"")",male,39,0,0,250655,26,,S,,,
2,no,"Faunthorpe, Mr. Harry",male,40,1,0,2926,26,,S,,286,"England / Philadelphia, PA"
2,no,"Carter, Mrs. Ernest Courtenay (Lilian Hughes)",female,44,1,0,244252,26,,S,,,London
2,no,"Hold, Mr. Stephen",male,44,1,0,26707,26,,S,,,"England / Sacramento, CA"
2,no,"McKane, Mr. Peter David",male,46,0,0,28403,26,,S,,,"Rochester, NY"
2,no,"Louch, Mr. Charles Alexander",male,50,1,0,SC/AH 3085,26,,S,,121,"Weston-Super-Mare, Somerset"
2,no,"Carter, Rev. Ernest Courtenay",male,54,1,0,244252,26,,S,,,London
2,no,"Downton, Mr. William James",male,54,0,0,28403,26,,S,,,"Holley, NY"
2,no,"Howard, Mrs. Benjamin (Ellen Truelove Arman)",female,60,1,0,24065,26,,S,,,"Swindon, England"
2,no,"Howard, Mr. Benjamin",male,63,1,0,24065,26,,S,,,"Swindon, England"
2,no,"Collyer, Mr. Harvey",male,31,1,1,C.A. 31921,26.25,,S,,,"Bishopstoke, Hants / Fayette Valley, ID"
2,no,"Hart, Mr. Benjamin",male,43,1,1,F.C.C. 13529,26.25,,S,,,"Ilford, Essex / Winnipeg, MB"
2,no,"Jacobsohn, Mr. Sidney Samuel",male,42,1,0,243847,27,,S,,,London
2,no,"del Carlo, Mr. Sebastiano",male,29,1,0,SC/PARIS 2167,27.7208,,C,,295,"Lucca, Italy / California"
2,no,"West, Mr. Edwy Arthur",male,36,1,2,C.A. 34651,27.75,,S,,,"Bournmouth, England"
2,no,"Nasser, Mr. Nicholas",male,32.5,1,0,237736,30.0708,,C,,43,"New York, NY"
2,no,"Jefferys, Mr. Ernest Wilfred",male,22,2,0,C.A. 31029,31.5,,S,,,"Guernsey / Elizabeth, NJ"
2,no,"Jefferys, Mr. Clifford Thomas",male,24,2,0,C.A. 31029,31.5,,S,,,"Guernsey / Elizabeth, NJ"
2,no,"Denbury, Mr. Herbert",male,25,0,0,C.A. 31029,31.5,,S,,,"Guernsey / Elizabeth, NJ"
2,no,"Drew, Mr. James Vivian",male,42,1,1,28220,32.5,,S,,,"Greenport, NY"
2,no,"Harper, Rev. John",male,28,0,1,248727,33,,S,,,"Denmark Hill, Surrey / Chicago"
2,no,"Nicholls, Mr. Joseph Charles",male,19,1,1,C.A. 33112,36.75,,S,,101,"Cornwall / Hancock, MI"
2,no,"Mallet, Mr. Albert",male,31,1,1,S.C./PARIS 2079,37.0042,,C,,,"Paris / Montreal, PQ"
2,no,"Brown, Mr. Thomas William Solomon",male,60,1,1,29750,39,,S,,,"Cape Town, South Africa / Seattle, WA"
2,no,"Laroche, Mr. Joseph Philippe Lemercier",male,25,1,2,SC/Paris 2123,41.5792,,C,,,Paris / Haiti
2,no,"Sweet, Mr. George Frederick",male,14,0,0,220845,65,,S,,,"Somerset / Bernardsville, NJ"
2,no,"Herman, Mr. Samuel",male,49,1,2,220845,65,,S,,,"Somerset / Bernardsville, NJ"
2,no,"Deacon, Mr. Percy William",male,17,0,0,S.O.C. 14879,73.5,,S,,,
2,no,"Davies, Mr. Charles Henry",male,18,0,0,S.O.C. 14879,73.5,,S,,,"Lyndhurst, England"
2,no,"Dibden, Mr. William",male,18,0,0,S.O.C. 14879,73.5,,S,,,"New Forest, England"
2,no,"Hickman, Mr. Stanley George",male,21,2,0,S.O.C. 14879,73.5,,S,,,"West Hampstead, London / Neepawa, MB"
2,no,"Hood, Mr. Ambrose Jr",male,21,0,0,S.O.C. 14879,73.5,,S,,,"New Forest, England"
2,no,"Hickman, Mr. Leonard Mark",male,24,2,0,S.O.C. 14879,73.5,,S,,,"West Hampstead, London / Neepawa, MB"
2,no,"Hickman, Mr. Lewis",male,32,2,0,S.O.C. 14879,73.5,,S,,256,"West Hampstead, London / Neepawa, MB"
3,no,"Johnson, Mr. William Cahoone Jr",male,19,0,0,LINE,0,,S,,,
3,no,"Leonard, Mr. Lionel",male,36,0,0,LINE,0,,S,,,
3,no,"Johnson, Mr. Alfred",male,49,0,0,LINE,0,,S,,,
3,no,"Betros, Mr. Tannous",male,20,0,0,2648,4.0125,,C,,,Syria
3,no,"Nysveen, Mr. Johan Hansen",male,61,0,0,345364,6.2375,,S,,,
3,no,"Lemberopolous, Mr. Peter L",male,34.5,0,0,2683,6.4375,,C,,196,
3,no,"Thomas, Mr. Charles P",male,29.88113,1,0,2621,6.4375,,C,,,
3,no,"Thomas, Mr. John",male,29.88113,0,0,2681,6.4375,,C,,,
3,no,"Holm, Mr. John Fredrik Alexander",male,43,0,0,C 7075,6.45,,S,,,
3,no,"Wiklund, Mr. Jakob Alfred",male,18,1,0,3101267,6.4958,,S,,314,
3,no,"Wiklund, Mr. Karl Johan",male,21,1,0,3101266,6.4958,,S,,,
3,no,"Johanson, Mr. Jakob Alfred",male,34,0,0,3101264,6.4958,,S,,143,
3,no,"Hegarty, Miss. Hanora ""Nora""",female,18,0,0,365226,6.75,,Q,,,
3,no,"Burke, Mr. Jeremiah",male,19,0,0,365222,6.75,,Q,,,"Co Cork, Ireland Charlestown, MA"
3,no,"Hart, Mr. Henry",male,29.88113,0,0,394140,6.8583,,Q,,,
3,no,"Flynn, Mr. John",male,29.88113,0,0,368323,6.95,,Q,,,
3,no,"Ekstrom, Mr. Johan",male,45,0,0,347061,6.975,,S,,,"Effington Rut, SD"
3,no,"Pearce, Mr. Ernest",male,29.88113,0,0,343271,7,,S,,,
3,no,"Braund, Mr. Lewis Richard",male,29,1,0,3460,7.0458,,S,,,"Bridgerule, Devon"
3,no,"Coelho, Mr. Domingos Fernandeo",male,20,0,0,SOTON/O.Q. 3101307,7.05,,S,,,Portugal
3,no,"Assam, Mr. Ali",male,23,0,0,SOTON/O.Q. 3101309,7.05,,S,,,
3,no,"Ali, Mr. Ahmed",male,24,0,0,SOTON/O.Q. 3101311,7.05,,S,,,
3,no,"Ali, Mr. William",male,25,0,0,SOTON/O.Q. 3101312,7.05,,S,,79,Argentina
3,no,"Sutehall, Mr. Henry Jr",male,25,0,0,SOTON/OQ 392076,7.05,,S,,,
3,no,"Asim, Mr. Adola",male,35,0,0,SOTON/O.Q. 3101310,7.05,,S,,,
3,no,"Goncalves, Mr. Manuel Estanslas",male,38,0,0,SOTON/O.Q. 3101306,7.05,,S,,,Portugal
3,no,"Jardin, Mr. Jose Neto",male,29.88113,0,0,SOTON/O.Q. 3101305,7.05,,S,,,
3,no,"Jensen, Mr. Svend Lauritz",male,17,1,0,350048,7.0542,,S,,,
